adapterId,adapterName,scenarioId,scenarioName,stepId,status,durationMs,errorMessage,responseText
"deepseek","DeepSeek","ai-resume-tool-review","AI 简历工具盘点","ai-resume-01","success","60476","","根据搜索结果，我为你整理了几个目前备受推荐、功能各有侧重的AI简历工具。你可以根据自己的需求快速选择。🛠️ 主流AI简历工具对比下面的表格汇总了四款核心工具的关键信息，方便你快速对比。工具名称核心AI功能/特色平台/获取方式参考评分/评价是否免费？智联招聘 (智联校园)内容优化与岗位匹配：与招聘平台深度结合，AI根据目标职位优化简历，提供岗位推荐。微信搜索“智联校园”小程序综合评分9.9/10部分功能免费 (AI简历优化可免费领取)职徒简历全流程辅助：AI简历生成、多版本管理、简历评分、面试模拟。网站、App综合评分9.5/10免费+付费模式UP简历对话式生成与精准匹配：通过AI对话生成初稿，一键分析简历与职位描述（JD）的匹配度。网站综合评分9.2/10部分功能免费 (对话生成、JD匹配评分免费)Kickresume强AI写作与美观设计：利用GPT模型生成专业内容，模板设计感强，适合英文简历。网站被多个评测推荐免费试用+付费除了以上工具，如果你希望简历有更强的设计感和视觉创意，还可以考虑：Canva：全球知名的设计平台，拥有海量精美简历模板和灵活的编辑功能，适合创意、设计类岗位。即时设计：国产专业设计工具，同样模板丰富，设计自由度非常高。💡 如何选择适合你的工具？你可以根据自己最急迫的需求来决策：如果你是求职新手，不知如何下笔：建议从UP简历的对话式生成开始，或者使用智联校园的AI优化，它们能帮你快速搭建起专业的内容框架。如果你追求高效，希望一份简历精准投递：重点关注工具的JD匹配功能。UP简历和智联招聘在这方面表现突出，能有效提升简历通过机器筛选（ATS）的概率。如果你更看重视觉设计和简历美观度：Canva、即时设计或Kickresume是更好的选择。如果你的目标是海外或外企岗位：Kickresume、Rezi等国际工具在英文简历撰写和ATS优化上更具优势。希望以上信息能帮助你做出选择。如果你能告诉我你的求职行业（如技术、设计、市场等）或者目前制作简历时遇到的最大困难，我可以为你提供更具针对性的建议。"
"deepseek","DeepSeek","ai-resume-tool-review","AI 简历工具盘点","ai-resume-02","success","60139","","在简历的生成和优化方面，市面上主流的AI工具主要通过对话引导、智能润色和岗位匹配三大功能来帮助你。你可以根据下表的快速对比，结合自己的核心需求来选择。工具名称核心优势核心的AI功能UP简历降低门槛：对话式生成，对新手友好，轻松解决“无从下笔”的难题。对话式生成、JD精准匹配分析、AI一键润色。职徒简历服务全面：除了简历，还整合了AI面试模拟、押题等“一站式”求职功能。AI简历优化与代写、简历智能评测、多版本管理。智联招聘（智联校园）精准高效：依托招聘平台的海量数据，生成的简历更贴合HR视角和岗位需求。AI简历生成与优化、精准岗位匹配、与招聘流程深度结合。Kickresume专业设计：尤其擅长制作专业、美观的英文简历，模板设计感强，并注重通过ATS系统筛选。基于GPT的AI生成、ATS友好模板与优化、专业求职信生成。🛠️ 如何挑选最适合你的工具？你可以根据自己的具体场景，参考以下建议：如果你是求职新手或职场新人，最怕“无从下笔”：首选 UP简历。它的对话式生成功能能像聊天一样引导你梳理经历，非常适合零基础起步。如果你已有一份初稿，希望它更专业、更匹配岗位：针对国内求职：智联校园的优化工具能利用平台数据，让你的简历更“对HR胃口”，且部分功能可免费使用。针对外企或海外求职：Kickresume 的ATS优化和专业英文写作能力是显著优势。如果你希望一个工具搞定“简历+面试”全流程：职徒简历是典型代表，它的AI模拟面试等功能可以让你在一个平台内完成多项求职准备。如果你追求简历出色的视觉设计和专业排版：Kickresume或之前提到的Canva都提供了大量高质量模板。💡 使用AI工具的重要提示保证信息真实：AI是“编辑”而非“作家”，所有经历和数据的基石必须是真实的你。进行人工复核：生成后务必仔细检查，确保逻辑通顺，没有“AI腔”或错误。进行针对性调整：针对不同的目标公司和岗位，利用工具的JD匹配功能进行微调，实现“一岗一简历”。如果你能分享一下你的目标行业（如互联网、金融、外企等）或当前简历所处的阶段（是毫无头绪，还是有初稿需要优化），我可以为你提供更具体的建议。"
"deepseek","DeepSeek","ai-resume-tool-review","AI 简历工具盘点","ai-resume-03","success","60118","","我为你筛选了多个提供免费功能的AI简历工具。它们各有侧重，免费版的功能限制也各不相同，你可以根据以下对比快速选择。工具名称免费版主要功能免费版核心限制付费版解锁内容 (参考)UP简历AI对话生成初稿、一键润色、JD精准匹配、200+专业模板、拖拽排版仅能导出一份高清无水印简历无限生成/优化、全模板、求职信生成等 (约19.9元/月)智联校园AI简历工具结合DeepSeek模型优化简历，能根据目标职位生成针对性内容无明确提及功能限制，但需按指引在公众号或小程序内免费领取使用权益不适用职徒简历海量中英文模板、智能排版、简历案例库参考能创建1个简历，每天可下载5次PDFAI优化、更多简历数量等 (月约18元)超级简历海量免费经典模板、简洁的在线编辑过往版本有字体、水印等隐藏限制，最新限制建议查看官网高级模板、AI写作助手等 (月约19.9元)TalenCat实时编辑、多简历云同步、基础AI优化、ATS检查器可创建2份简历，部分AI功能可能受限无限简历、全部AI功能 (约4.9美元/月)💡 如何选择及使用建议结合你的不同目标，可以参考以下建议：追求快速上手和智能生成：首选UP简历的免费版。它的对话式生成对新手极其友好，可以先用它高效搭建简历框架。如果只投递1个核心岗位，其免费导出次数可能就够用。已有初稿，希望获得针对性优化：使用智联校园的免费AI工具。它背靠招聘平台数据，优化角度可能更贴合国内HR的筛选习惯。需要制作多份简历或频繁修改：免费版在简历创建数量上通常有限制（如职徒简历限1份，TalenCat限2份）。如果你的求职目标多样，需要频繁调整，可能稍感不便。📝 使用免费工具的重要提示核心信息要真实：AI是“优化师”而非“作家”，所有经历和数据必须基于真实情况。务必人工复核：生成后仔细检查逻辑、数据和个人信息，避免出现“AI腔”或事实错误。善用匹配功能：针对不同岗位，利用工具的JD匹配分析功能进行微调，能有效提升简历的针对性。如果你能告诉我你的求职目标（例如是专注一个岗位，还是需要海投多个不同岗位），我可以为你提供更具体的组合使用建议。"
"deepseek","DeepSeek","ai-resume-tool-review","AI 简历工具盘点","ai-resume-04","success","60131","","为你按身份整理了推荐工具和理由，下表可帮你快速决策：身份/需求首推工具核心理由 & 关键功能备选方案应届毕业生UP简历1. 解决“无话可写”：对话式引导挖掘校园经历。2. 提升专业性：将活动、课程项目转化为专业描述。3. 精准匹配：用JD匹配功能抓住岗位关键词。职徒简历：案例库丰富，可参考同龄人范例。程序员/技术岗TalenCat简历1. 技术栈高亮：优化技术术语，匹配ATS关键词。2. 项目描述强化：AI帮助量化成果、突出技术难点。3. 多版本管理：方便为不同技术栈岗位定制简历。超级简历：模板简洁专业，适合技术岗审美。跨行业求职者智联校园AI工具1. 能力“翻译”：将原行业经验匹配新岗位所需能力。2. 视角贴合HR：基于招聘数据，用HR熟悉的语言呈现。3. 行业关键词：确保简历包含目标行业的专业术语。UP简历：用JD匹配功能快速调整方向。💡 通用建议与核心步骤无论何种身份，使用AI工具都应遵循以下核心步骤，以确保简历既专业又真实：真实输入：向AI提供你最原始、详细的经历（哪怕像流水账），这是优质输出的基础。定向优化：针对每一个目标职位，使用工具的“JD匹配”或“一键优化”功能，让简历更具针对性。人工精修：仔细检查AI生成的内容，修正“AI腔”，确保逻辑清晰、数据准确。善用模板：选择与行业气质相符的简洁、专业的模板，确保格式兼容（PDF格式投递）。🎯 针对你身份的一些额外提示程序员：在项目描述中，务必用AI突出技术栈、量化成果（如性能提升百分比）和解决的核心难点。跨行者：重点用AI完成“能力迁移”，思考并提炼原行业中可迁移的软技能和项目经验。你可以告诉我更具体的求职方向（如目标公司类型、岗位），我可以为你分析在这些工具的免费版中，如何最高效地组合使用它们。"
"deepseek","DeepSeek","ai-resume-tool-review","AI 简历工具盘点","ai-resume-05","success","60117","","当然有，这类“一站式”AI求职平台越来越多了。它们整合了简历、职位匹配甚至求职信等多项服务，可以帮你省去在多个工具间切换的麻烦。为了让你清晰对比，我将其中具有代表性的三个平台整理如下：平台名称平台性质 / 访问方式核心一站式服务功能主要特点 / 适合人群自猎智聘专业AI招聘平台 / 独立App或网站AI简历优化、智能岗位匹配与推荐、AI数字人面试、一键发送Offer流程。全流程智能化，号称对求职者完全免费。适合希望深度利用AI完成全链路求职的用户。超级简历 (+i人事)主流简历工具延伸 / App、网站智能简历制作与优化、ATS兼容性检查、岗位匹配度分析、一键批量投递。简历工具起家，整合了求职功能。其“i人事”模块专攻匹配与投递。适合从做好简历开始，并需要高效海投的用户。快上岸聚焦大学生的求职小程序 / 微信小程序AI简历优化、央国企等岗位实时搜索与匹配、智能面试辅导、笔面试题库。精准聚焦大学生，特别是想考公、进央国企的群体。功能闭环，针对性强。💡 如何选择与补充建议你可以根据自己的核心需求来决策：追求“一步到位”的全新体验：可以尝试 自猎智聘 这类新兴的纯AI Agent平台，体验从匹配到模拟面试的全流程。以“简历优化”为核心，兼顾高效投递：超级简历 是更稳妥的选择，它的简历编辑和AI优化功能扎实，整合的投递功能也实用。目标明确，主攻公务员或央国企：快上岸 小程序提供的岗位信息和针对性辅导会非常有用。利用综合性AI工具作为补充：像 DeepSeek、Kimi 或 讯飞星火 这类通用大模型，也可以帮助你进行求职信撰写、模拟面试问答等，非常灵活。总的来说，AI求职平台的关键优势在于效率和针对性。但是，你需要记住，平台提供的职位库决定了你的机会广度，所以最好将这些平台与你心仪公司的官方招聘渠道结合使用。同时，切勿完全依赖AI，对于AI生成的任何内容（尤其是简历和求职信），一定要亲自复核、修改，确保其真实且符合你本人的特点。如果你有特别想关注的行业（比如互联网、金融），或者想了解如何具体组合使用这些平台，我可以再提供一些更具体的思路。"
"deepseek","DeepSeek","ai-resume-tool-review","AI 简历工具盘点","ai-resume-06","success","60171","","没有工具能保证“通过率最高”，因为ATS本身也千差万别。不过，一些工具的核心功能专门为通过ATS筛选而设计，能显著提高成功率。以下是几款在ATS优化方面具备明显优势的工具对比，你可以根据个人情况进行选择。工具名称ATS相关核心功能与优势适合人群免费版情况参考Cake AI: 履历健檢专门针对ATS，提供格式检查、关键词匹配度分析、量化建议的“体检报告”。追求精准优化，希望获得具体修改指导的用户。官网（success.iscake.com）显示可免费检查。UP简历AI对话生成后，可粘贴职位描述（JD）进行智能匹配分析，优化内容贴合度。求职新手，需要从零开始并确保内容匹配岗位的用户。核心功能免费，但免费版导出的简历数量有限。超级简历 (WonderCV)提供大量经ATS测试的简洁模板，引导用STAR法则撰写经历，内容结构规范。需要海量模板选择，习惯自行调整内容框架的用户。基础模板和编辑免费，高级功能需付费。多面鹅核心是根据JD逐字逐句智能改写简历，强调“一岗一简历”，匹配精度高。海投多个岗位，希望为每个岗位快速生成定制版简历的用户。需查询官网最新政策。Apply AI宣称能提供70%更好的ATS兼容性，一站式生成简历、求职信。希望一个工具搞定申请全套材料（简历、求职信）的用户。提供“免费开始”选项，采用免费增值模式。💡 如何真正提升ATS通过率比起依赖单一工具，更重要的是掌握以下原则，并组合使用工具：手动完成关键词提取：这是最关键的一步。仔细阅读职位描述，提取高频出现的名词（技术、工具） 和动词（技能），并自然地融入简历。使用“体检”工具：用 Cake AI 这类工具检查格式、关键词密度等硬性指标。使用“优化”工具：用 UP简历、多面鹅 的匹配功能，将你的原始经历优化得更专业、更贴合岗位。最终格式检查：使用简单、标准的字体（如Arial、宋体）。避免表格、文本框、图片等复杂格式，它们可能导致ATS解析错误。最终以 PDF格式 投递，但务必确保生成PDF的源文件格式简单。对于你之前提到的程序员或跨行业身份，多面鹅的精准JD匹配和 UP简历的对话引导生成会是很好的互补组合。你可以先用UP简历搭建专业内容框架，再用多面鹅针对不同岗位进行精准微调。如果你有特定的目标公司或岗位，我可以帮你分析如何更有针对性地运用这些工具来组织简历内容。"
"deepseek","DeepSeek","ai-resume-tool-review","AI 简历工具盘点","ai-resume-07","failed","120722","等待新回答超时，未检测到内容更新。",""
"deepseek","DeepSeek","ai-resume-tool-review","AI 简历工具盘点","ai-resume-08","success","60151","","对于完全没有经验的新手来说，最重要是工具能“手把手”引导，而不是给一堆选项让人无从下手。根据你的要求，以下几款工具在引导性和上手简易度上表现突出：为了方便你快速对比，我将它们的核心引导特点整理如下：工具名称核心引导方式 / 易用性特别适合小白的理由UP简历对话式生成：像聊天一样回答AI问题，自动生成初稿。从零引导：完美解决对空白文档的恐惧，问题具体，引导细致。智联校园（小程序）流程内嵌式：在熟悉的微信小程序内，按步骤提供优化和模板。路径清晰：无需注册复杂账号，在求职平台内一站式完成，场景自然。超级简历 (WonderCV)结构化填写：界面清晰，分模块引导填写，强调整洁与规范。逻辑清晰：像填表格一样简单，不易遗漏信息，培养规范的简历结构意识。Reactive Resume极简开源：完全免费、无广告、界面干净，提供基础模板和简单编辑。无干扰：适合希望极度简洁、自主控制，不想被复杂功能打扰的新手。💡 给新手的具体行动建议综合来看，你可以这样开始：零基础快速启动：强烈建议从 UP简历 开始。它的“对话式生成”功能能帮你最轻松地度过最难的“从零到一”阶段。你可以先和AI聊天生成一份初稿，再根据之前的建议使用它的“JD匹配”等功能进行优化。在投递中优化：如果你的求职目标（尤其是针对国内企业）比较明确，可以同时使用 智联校园小程序。将UP简历生成的初稿，用智联的AI工具进行针对性优化，并直接使用其平台上的模板，实现优化、美化到投递的闭环。保持格式简洁：无论用哪个工具，最终导出前，务必检查格式是否足够简单、干净（避免花哨的排版、图形和复杂表格），以确保简历能通过公司的ATS（简历筛选系统）。📝 一个简单的通用入门步骤你可以遵循以下四步，无论使用哪款工具都适用：准备素材：先把自己的教育背景、所有经历（实习/社团/项目/工作）、技能证书等，像列清单一样简单罗列出来。借助AI生成：将清单内容输入到 UP简历 的对话中，让AI帮你扩展、优化成专业描述。进行针对性调整：找到1个你最想申请的职位描述（JD），使用工具的“匹配”功能，检查并加入关键词。进行最终检查：通读一遍，确保没有错别字，然后导出为PDF格式进行投递。如果你确定了具体的求职"
"deepseek","DeepSeek","ai-resume-tool-review","AI 简历工具盘点","ai-resume-09","failed","120432","等待新回答超时，未检测到内容更新。",""
"deepseek","DeepSeek","ai-resume-tool-review","AI 简历工具盘点","ai-resume-10","success","60126","","这是一个非常关键的问题。根据搜索结果，专门比较各工具安全水平的公开测评很少，但我们可以通过分析工具的运营模式和技术架构，找到在数据安全和隐私保护方面通常更有优势的类型和具体工具。🔐 不同AI简历工具的安全模式对比为了清晰展示，我将常见的AI简历工具按安全模式分为两类：安全模式 / 代表工具核心特点对用户隐私的保障逻辑1. 开源与自托管模式Reactive Resume完全掌控数据：你可以将这款开源软件部署在自己的电脑或服务器上，所有数据（包括AI调用）都留在本地，不与任何外部服务器同步。最高级别。你完全拥有数据的控制权，理论上不存在数据泄露给第三方的风险。这是最根本的解决方案。2. 云端SaaS服务的“优等生”超级简历强调企业级防护：服务商主动宣传并实施银行级SSL加密、ISO27001等信息安全认证、严格的内部权限控制和数据安全审计机制。非常高。服务商通过技术投入和合规认证来建立信任，并明示其安全措施。但数据最终存储在服务商的云端。注：搜索结果中的其他网页主要讨论智慧校园或招聘行业的通用安全趋势，并非针对具体AI简历工具的评测，因此未列入上表。而是一份通用隐私政策的示例，缺乏具体性。和则主要提示了AI简历工具普遍存在的隐私风险，但没有对比或推荐具体工具。💡 如何根据你的情况做选择你可以根据自己的技术能力和隐私担忧程度来决定：首选推荐（技术爱好者或极度敏感者）：选择 Reactive Resume 并自行部署。优点：这是解决隐私问题的终极方案。你的姓名、电话、工作经历等所有信息都不会离开你的设备。门槛：需要你有一些技术基础，能够按照开源项目的指引完成本地安装和配置。次选推荐（绝大多数用户）：选择像 超级简历 这样主动公示了详细安全措施和合规认证的云端服务。优点：无需技术部署，使用方便，且在同类云端工具中安全透明度更高。注意：使用任何云端工具前，务必仔细阅读其《隐私政策》，重点查看“数据如何收集和使用”、“是否与第三方共享”以及“数据保留期限”等条款。避免使用那些"
"deepseek","DeepSeek","ai-resume-tool-review","AI 简历工具盘点","ai-resume-11","failed","140316","等待新回答超时，未检测到内容更新。",""