adapterId,adapterName,scenarioId,scenarioName,stepId,status,durationMs,errorMessage,responseText
"deepseek","DeepSeek","ai-resume-tool-review","AI 简历工具盘点","ai-resume-01","success","60486","","根据你的需求，我整理了几个目前评价不错的AI简历工具，它们各有侧重，你可以根据自己的情况来选择。下面这个表格介绍了几个主流工具及其核心功能，方便你快速了解。工具名称主要特点适用人群智联招聘 - 智联校园与招聘平台深度结合，提供AI简历优化和精准岗位匹配，资源丰富。国内求职者，尤其适合应届毕业生。职徒简历AI自动提炼核心技能，提供案例库、简历评分和个性化优化建议，功能综合。年轻求职者，希望获得全方位职业指导的用户。超级简历 (WonderCV)ATS友好的模板库，提供智能排版和内容建议，能进行简历可读性分析与结构评分。追求效率、注重简历专业度的学生和白领。鹅来面 (OfferGoose)核心功能是智能匹配分析，可将你的简历与职位描述对比，高亮缺失关键词并指导修改。所有专业应届生，尤其希望简历能精准投递目标岗位的用户。104 AI+工具集成在招聘平台内，提供AI履历健检、扫描生成、自我推荐信等一站式求职服务。使用104平台、希望提升面试机率的台湾地区求职者。💡 使用AI简历工具的几点建议为了让工具更好地为你服务，这里有几个小提示：明确职业目标：在使用前，先想清楚你的目标职位，这样AI生成的简历内容才会更具针对性。认真审查内容：AI生成的简历是一个很好的初稿，但你仍需仔细检查和修改，确保信息准确并符合你的个人风格。注意信息隐私：选择信誉良好的平台，并留意其隐私政策，保护好个人信息。💎 如何选择？如果你在国内求职，且是应届生，可以从智联校园或职徒简历入手。如果你希望简历能精准匹配某个心仪的职位，可以试试鹅来面的JD分析功能。如果你追求简历的专业度和排版，超级简历的模板和评分系统会很有帮助。希望这些信息能帮你做出决定。如果你对某个工具有更具体的问题，或者想了解它们在某些行业上的表现，可以告诉我，我再为你进一步介绍。"
"deepseek","DeepSeek","ai-resume-tool-review","AI 简历工具盘点","ai-resume-02","success","60108","","在简历制作和优化方面，目前确实有几款功能相当出色的AI工具，它们各有侧重。为了让你能快速了解，我将这些工具的核心优势和使用场景整理成了一个表格。工具名称核心优势适用人群智联招聘 - 智联校园与招聘平台深度结合，提供精准岗位匹配和HR视角的简历优化。国内求职者，尤其是应届毕业生和在校生。职徒简历AI自动提炼核心技能，提供案例库参考、简历评分等综合职业指导。年轻求职者，希望获得全方位简历优化与职业规划的用户。超级简历ATS友好的模板和智能排版，能进行可读性分析与结构评分。追求简历专业度与排版，注重通过ATS筛选的学生和白领。ChatGPT灵活性极高，可根据你的指令完成撰写、重构、翻译等多种任务，但需要你提供清晰的指引。不依赖固定模板，愿意花时间与AI互动以深度定制简历的用户。💡 使用AI工具的小技巧工具虽好，但用对方法才能事半功倍。这里有几点建议可以帮助你更好地利用这些AI工具：明确职业目标：在开始之前，先想清楚你的目标职位。这样，在使用工具的岗位匹配或关键词提炼功能时，才能更具针对性。提供高质量信息：无论是使用专用工具还是ChatGPT，你输入的原始信息越具体、越详实，AI产出的结果就越精准。可以尝试将心仪职位的招聘描述（JD）直接提供给AI，让它帮你提取关键词和优化内容。量化成就与经历：在描述工作或实习经历时，避免使用""负责……""等模糊表述。多使用STAR法则（情境-任务-行动-结果），并尽可能用数字量化你的成果，例如“通过优化流程，使季度销售额提升了15%”。AI工具通常内置了强化这类表述的算法。人工审查与润色：AI生成的简历是很好的初稿，但你必须仔细检查和修改。确保信息准确无误、语言符合你自己的风格，并检查是否有夸大其词的地方。注意信息隐私：在选择工具时，留意其隐私政策。建议避免向AI工具提交过于敏感的个人信息，如身份证号、具体住址等。💎 如何选择？如果你在国内求职，是应届生或在校生，希望一站式解决求职问题，智联校园和职徒简历是非常不错的选择。如果你心仪的公司可能使用ATS系统进行初筛，或者你非常看重简历的专业排版，那么超级简历的模板和评分系统会很有帮助。如果你不满足于固定模板，希望深度定制每一段描述，并且愿意花时间与AI互动，那么ChatGPT能提供极大的灵活性。希望这些分析能帮你找到最适合自己的那把“利器”。如果你能告诉我你所处的行业或者具体的求职方向，或许我可以为你提供更具体的建议。"
"deepseek","DeepSeek","ai-resume-tool-review","AI 简历工具盘点","ai-resume-03","success","60097","","有的，目前确实有不少功能不错且真正免费的AI简历工具。它们各自的侧重点和免费策略有所不同，为了让你一目了然，我整理了一个核心工具的对比表格。工具名称核心免费功能主要免费限制适合人群Reactive Resume完全免费开源、12款专业模板、多语言支持、集成OpenAI辅助写作、PDF导出、无广告无明显功能限制注重数据隐私、需要高度定制化、追求纯粹免费体验的用户FlowCV第一份简历完全免费、50+模板、无水印PDF下载、所有设计功能可用免费版可能不包含AI写作功能；如需创建多份简历或使用AI功能可能需要付费需要快速制作一份高质量、设计感强的简历，且对AI功能需求不强的用户Teal免费的简历生成器、职位追踪器、强大的职位匹配分析（将简历与职位描述对比）免费版的AI内容生成功能有次数限制积极求职、希望精准优化简历以通过ATS筛选、管理多个求职进度的用户UP简历AI对话生成简历、JD精准匹配与优化、AI一键润色、海量模板、拖拽排版核心AI功能免费，可能通过高级服务（如更多简历数量或额外AI使用额度）实现盈利应届生和职场新人，尤其是不知如何下笔、希望简历内容与岗位高度匹配的用户Resume.com完全免费使用、专业模板、无限下载、无水印缺乏AI内容生成和优化功能预算极度有限，仅需基础、无广告的简历创建和导出功能的用户💡 使用免费AI简历工具的小技巧为了让你更好地利用这些工具，这里有几个建议：明确免费与付费的边界：在使用前，可以先快速浏览一下工具的定价页面或FAQ，了解其免费策略是“完全免费”还是“免费增值”，避免做到一半才发现关键功能需要付费。准备一份“初稿”：即使是使用AI，你也需要向它提供关于你教育背景、工作经历等的基础信息。提前梳理好这些内容，能让你使用AI生成时事半功倍。善用职位描述（JD）：对于具备职位匹配分析功能的工具（如Teal、UP简历），一定要将心仪岗位的职位描述粘贴进去。这是让AI为你精准优化的最关键一步。人工审查与润色必不可少：AI生成的内容是一个优秀的起点，但并非完美。务必仔细检查是否存在事实错误、夸大其词，或者语言是否生硬，确保最终的简历真实地代表了你本人。注意信息隐私：留意工具的隐私政策。通常，选择那些承诺不出售用户数据、处理过程透明的工具会更安心。🎯 如何选择适合你的工具你可以根据自己的核心需求来做决定：如果你追求极致的免费、无广告和无水印，同时需要AI辅助写作，Reactive Resume 是非常可靠的选择。如果你不知从何写起，希望AI能引导你并帮你生成初稿，那么具备对话式生成功能的 UP简历 会很适合你。如果你的目标是通过大公司的ATS机筛，需要精准的关键词匹配，Teal 的职位匹配功能将是你的利器。如果你只需要一个干净、无干扰的环境来快速做出一份设计精良的简历，那么 FlowCV 或 Resume.com 能很好地满足你。希望这份梳理能帮助你找到最合适的工具。如果你能告诉我你所处的求职阶段（例如是应届生还是职场人士），或许我可以为你提供更具体的建议。"
"deepseek","DeepSeek","ai-resume-tool-review","AI 简历工具盘点","ai-resume-04","success","60098","","不同背景的求职者，在制作简历时的侧重点确实不同。我为你整理了一些在对应领域表现不错的AI简历工具，并分析了它们的特点，希望能帮你做出选择。下面这个表格汇总了针对不同身份的工具推荐及其核心优势。求职身份推荐工具核心优势与适用理由应届毕业生智联招聘 - 智联校园依托大型招聘平台，岗位匹配精准，尤其适合寻找校招、实习及央企国企岗位。职徒简历提供行业简历案例库和简历评分系统，能帮你把课程设计、学生会等经历转化为专业的项目描述。UP简历AI对话式生成功能友好，能引导你从零开始，一步步将经历梳理成文，解决“无从下笔”的痛点。程序员CodeCV专为互联网从业者设计，支持 Markdown语法，能生成技术友好、排版整洁的专业简历。简单简历属于技术专精型工具，设计上更侧重内容和专业性，适合程序员和工程师群体。跨行业求职者Offer来了核心功能是 “JD基因级匹配” ，能深度分析目标岗位描述，将你原有的经历翻译成新行业的术语。Teal擅长AI智能优化，能帮助你精准地根据新行业的要求调整和优化简历内容。💡 使用AI简历工具的通用技巧无论你选择哪款工具，以下几点建议都能帮助你更好地利用它们：提供高质量的信息：你输入的原始经历越具体，AI优化的基础就越好。在描述经历时，多使用数字来量化你的成果。善用职位描述（JD）：对于具备匹配分析功能的工具，一定要将心仪岗位的职位描述粘贴进去。这是让AI为你精准优化的最关键一步。人工审查必不可少：AI生成的简历是一个优秀的初稿，但你必须仔细检查和修改，确保信息准确、没有夸大其词，并且语言符合你本人的风格。注意信息隐私：选择信誉良好的平台，留意其隐私政策，避免提交过于敏感的个人信息。🎯 如何做出最终选择你可以根据自己的核心需求来做决定：如果你在国内求职，是应届生，希望获得从简历到岗位的一站式服务，智联校园和职徒简历是非常不错的选择。如果你是一名程序员，追求简历的技术范和极简排版，那么CodeCV或简单简历会更适合你。如果你是一名跨行业求职者，核心诉求是让简历通过新行业的机筛，那么Offer来了和Teal的JD匹配功能将是你的利器。希望这份梳理能帮助你找到合适的工具，制作出令人眼前一亮的简历。当然，如果你能分享更具体的求职方向（例如目标公司或岗位），我也许能提供更具针对性的分析。"
"deepseek","DeepSeek","ai-resume-tool-review","AI 简历工具盘点","ai-resume-05","success","60101","","有的，目前已经有不少AI求职平台提供了从简历优化、职位匹配到求职信生成的一站式服务。我为你整理了几个具备这些功能的平台，你可以根据自己的需求进行选择。下面这个表格汇总了这些平台的核心功能，方便你快速了解。平台名称核心一站式服务功能104人力银行AI履历健检、AI推荐工作、AI履历扫描生成、AI自我推荐信Offer来了AI简历优化、AI求职信生成、AI模拟面试、涨薪规划与岗位管理Sousouoffer职业规划、简历定制、职位精准匹配、面试辅导、Offer分析猎聘 (AI服务)AI智能邀约、AI简历快读、意向人选推荐自猎智聘AI高精度人岗匹配、AI数字人智能面试、自动化决策拔俗AI平台简历诊断、智能岗位推荐、技能提升建议✨ 各平台特色与选择建议不同的平台在功能和侧重点上有所不同，你可以参考以下分析来挑选：104人力银行：平台提供的AI推荐工作功能，能根据你的履历和行为数据精准推荐职缺，据称可使面试机率提升3.2倍。同时，其AI自我推荐信功能可以帮你生成个性化的推荐信，避免使用千篇一律的模板。这对于希望高效获取面试机会、注重求职信质量的求职者来说非常友好。Offer来了：这个平台的特点在于深度优化，其AI简历优化功能可以实现“JD基因级匹配”，将你的经历描述与招聘要求的关键词进行深度匹配，提升简历在招聘系统中的通过率。同时，它集成了AI模拟面试功能，能帮助你提前演练，提升面试表现。非常适合希望在简历和面试环节都进行精细化准备的求职者。Sousouoffer：平台提供从职业规划、简历定制到职位匹配、面试辅导乃至Offer分析的全链条服务。特别适合求职目标尚不明确，需要系统性的职业规划和全程辅导的应届毕业生或初入职场者。猎聘与自猎智聘：这两个平台更侧重于利用AI技术提升人岗匹配的效率和精准度。例如，猎聘的AI账号能帮助企业智能邀约和快速筛选简历；自猎智聘则致力于通过AI Agent实现招聘全流程的自动化。虽然部分功能主要面向企业端，但作为求职者，你也能间接享受到更高效的职位匹配服务。拔俗AI平台：这是一个连接求职者、高校与企业的智能枢纽，不仅提供岗位推荐，还会给出技能提升建议。如果你在求职的同时，也希望了解自身的能力短板并进行提升，可以关注这类平台。💡 使用一站式AI求职平台的小贴士为了让你更好地利用这些工具，这里有几个建议：主动利用匹配功能：对于具备职位匹配分析功能的平台，务必上传或输入你心仪职位的招聘描述（JD）。这是让AI为你精准优化的最关键一步。**善用模拟面试"
"deepseek","DeepSeek","ai-resume-tool-review","AI 简历工具盘点","ai-resume-06","failed","120488","等待新回答超时，未检测到内容更新。",""
"deepseek","DeepSeek","ai-resume-tool-review","AI 简历工具盘点","ai-resume-07","failed","120520","等待新回答超时，未检测到内容更新。",""
"deepseek","DeepSeek","ai-resume-tool-review","AI 简历工具盘点","ai-resume-08","failed","120446","等待新回答超时，未检测到内容更新。",""
"deepseek","DeepSeek","ai-resume-tool-review","AI 简历工具盘点","ai-resume-09","success","60069","","专门针对简历优化设计的AI工具，在求职的垂直场景下确实比ChatGPT这类通用模型更具优势。它们内置了招聘行业的专业知识，能更精准地把握HR和ATS（申请人跟踪系统）的筛选逻辑。下面这个表格汇总了几款有代表性的专业简历AI工具及其核心功能，方便你快速了解。工具名称核心功能与优势适用人群鹅来面 (OfferGoose)JD匹配度分析：将你的简历与职位描述逐句对比，高亮缺失的关键词。STAR法则具象化：引导你将经历改写成结构清晰、结果量化的专业描述。模拟面试反哺简历：通过模拟面试发现表述弱点，回头优化简历。所有专业的应届生，尤其希望简历能精准投递目标岗位的用户。智联招聘 - 智联校园HR视角优化：依托招聘平台大数据，使简历内容更贴合HR的偏好。精准岗位匹配：直接关联平台内丰富的校招和实习岗位。国内求职者，尤其适合应届毕业生。职徒简历AI自动提炼核心技能，提供案例库、简历评分和个性化优化建议，功能综合。年轻求职者，希望获得全方位职业指导的用户。BeamJobs Bullet Point Generator要点生成与评分：专攻工作经历描述，实时生成并评分，确保每句话都使用强动作词并展示业务影响。需要精细化打磨工作经历描述，尤其是求职外企或英文简历的用户。💡 专业简历工具与通用模型的核心区别你可以把专业工具看作是配备了专业赛车轮胎和调校的赛车，而通用模型则是性能强劲但用途广泛的跑车。两者都很快，但在特定赛道上，专业赛车的表现无疑更胜一筹。对比维度专业简历AI工具通用大模型 (如ChatGPT)行业知识内置招聘行业知识（如ATS偏好、HR筛选习惯）和冰山模型等评估理论，优化更有针对性。缺乏垂直领域深度，反馈可能流于表面，无法洞察简历筛选的""潜规则""。核心功能提供JD匹配分析、STAR法则引导、内容评分、案例库等闭环工作流。本质是开放式对话，需要你自行提出所有要求并判断优化方向，对使用者要求高。内容可靠性优化建议基于大量成功简历数据和真实招聘案例，更为可靠。内容生成基于海量互联网文本，可能缺乏实证支持，甚至存在""幻觉""风险。交互体验体验更接近使用一个专属的求职APP，流程顺畅，功能集成度高。"
"deepseek","DeepSeek","ai-resume-tool-review","AI 简历工具盘点","ai-resume-10","failed","120549","等待新回答超时，未检测到内容更新。",""
"deepseek","DeepSeek","ai-resume-tool-review","AI 简历工具盘点","ai-resume-11","success","80122","","今日概览：AI简历工具正从单一生成向涵盖职位匹配、求职信生成的一站式求职平台演进。重点站点：智联招聘（国内主流平台，HR视角优化），职徒简历（案例库丰富，适合应届生），Teal（JD匹配精准，ATS友好），Reactive Resume（完全免费开源，隐私安全）。风险或待关注：需注意免费版功能限制、生成内容需人工审查核实、以及个人数据隐私问题。是否提到“智简”：否。"