adapterId,adapterName,scenarioId,scenarioName,stepId,status,durationMs,errorMessage,responseText
"deepseek","DeepSeek","ai-resume-tool-review","AI 简历工具盘点","ai-resume-01","success","60419","","根据你的需求，我为你整理了几个目前评价不错的AI简历工具，它们各有侧重，你可以根据自己的情况来选择。下面这个表格汇总了这些工具的核心特点和适用人群，方便你快速了解。工具名称核心功能与特点适合人群智联招聘-AI简历优化依托招聘平台资源，可根据目标职位生成针对性内容；提供全流程求职服务。适合希望通过国内主流招聘平台进行一站式求职的用户。鹅来面 (OfferGoose)独创“简历压力测试”，从面试官视角反向验证简历内容，暴露逻辑漏洞。适合希望深度优化简历，确保其能通过严格面试考验的求职者。Kimi智能助手基于强大的自然语言模型，擅长使用STAR法则润色和生成描述性文案。适合在语言表达上需要灵感和辅助，希望免费优化简历措辞的用户。超级简历 (WonderCV)提供海量专业模板和规范性引导，注重简历格式与排版的专业性。适合零基础的简历小白，希望快速制作一份标准、规范简历的用户。104 AI+工具提供AI履历健检、扫描生成、自我推荐信等全套功能，与求职平台深度整合。适合使用104人力银行等平台，并希望获得全面AI求职辅助的用户。Rezi.ai专注于优化简历以通过ATS（简历筛选系统）的机筛，提升网申通过率。适合主要投递大型企业、外企，担心简历在机筛环节被过滤的用户。💡 如何选择适合你的工具？你可以根据自己当前最迫切的需求来决定：如果你是求职新手，希望快速入门：可以从 超级简历 (WonderCV) 开始，利用其专业模板快速搭建一份合格的简历。如果你的简历已初步完成，希望它更具竞争力：强烈建议尝试 鹅来面 (OfferGoose)。它的“压力测试”能帮你发现简历中自己难以察觉的薄弱环节，让你的简历真正“能打”。如果你主攻特定类型的企业：投递国内公司，可以多用 智联招聘 或 104人力银行 的内置工具，其推荐和优化更贴合本地市场。投递外企或非常依赖网申，Rezi.ai 在通过ATS机筛方面有独特优势。如果你希望在语言表达上获得免费且强大的帮助：Kimi智能助手 是一个很好的选择，可以帮你润色语句、丰富表达。✨ 使用AI工具的小贴士记住，AI是你求职的“助手”而不是“主角”。为了让工具更好地为你服务，请注意：提供真实准确的信息：AI是基于你提供的信息进行优化的，输入的内容必须真实可靠。认真审查并个性化修改：AI生成的内容可能需要调整，请务必仔细检查，确保其准确并符合你个人的风格。不要过度依赖：你真实的经历和思考才是简历的灵魂，AI的作用是帮你更好地展示它们。希望这些信息能帮你做出选择。如果你对某个工具有更具体的使用疑问，或者想针对某种特定的求职场景（如转行、应届生等）进行了解，可以告诉我，我能为你提供更细致的分析。"
"deepseek","DeepSeek","ai-resume-tool-review","AI 简历工具盘点","ai-resume-02","success","60123","","在简历制作和优化方面，不同的AI工具各有侧重。为了让你能快速了解，我将几个功能强大的工具按其主要优势进行了分类，希望能帮你做出选择。工具类别工具名称主要优势🚀 与招聘平台深度整合智联招聘 - AI简历优化依托海量真实岗位数据，优化建议更贴合HR视角。🎯 专攻ATS系统通过率ResumeAI核心功能是确保简历能通过企业招聘系统的自动筛选。✍️ 强大的写作与表达辅助ChatGPT擅长根据你的原始信息，整合、结构化地生成和优化简历内容。Grammarly专注于语法校对、语气调整和文本精炼，让你的表达更专业。🎨 出色的设计与个性化Canva提供海量精美模板和易用的设计工具，轻松打造视觉出众的简历。💡 如何选择适合你的工具？你可以根据自己的核心需求来判断：如果你是求职新手，或希望简历内容更“对口”：智联招聘的AI工具是不错的选择。它能利用平台的数据优势，让你的简历描述更贴近目标职位的要求。如果你主要投递大型企业，担心简历在机筛环节被过滤：那么 ResumeAI 的专长正好能解决你的痛点。它能有效优化简历中的关键词和格式，提升通过ATS系统的概率。如果你在语言组织和表达上需要全面帮助：ChatGPT 可以作为一个强大的创作助手，帮你从零到一搭建内容框架、丰富描述。Grammarly 则像一位专业的校对员，能确保最终稿件的用词精准、专业且无误。如果你追求简历的视觉效果，希望在众多申请中一眼被看到：Canva 提供了极大的设计自由度，你可以借助其模板和AI设计工具，制作出既专业又个性的简历。🛠️ 使用AI工具的小贴士为了让这些工具更好地为你服务，这里有几个关键建议：提供真实准确的“原材料”：AI的产出质量高度依赖你的输入。请务必提供真实、详细的个人经历和信息，它才能在此基础上进行优化和美化。认真审查并个性化修改：AI生成的内容有时可能流于通用。完成初稿后，一定要亲自仔细检查，根据自身情况调整，确保简历准确并带有你个人的色彩。注意保护个人隐私：在使用在线工具，尤其是ChatGPT这类通用模型时，避免输入过于敏感的个人信息（如身份证号、具体住址等），以防潜在的数据风险。希望这些信息能帮助你做出选择。如果你愿意告诉我你具体的求职方向（例如应届生求职、转行、目标行业等），或许我可以为你提供更具针对性的建议。"
"deepseek","DeepSeek","ai-resume-tool-review","AI 简历工具盘点","ai-resume-03","success","60118","","根据你的需求，我为你整理了几个功能不错的免费AI简历工具。它们各具特色，但在免费版的功能上也会有一些限制。下面这个表格汇总了这些工具的核心免费功能和主要的限制，方便你快速了解和对比。工具名称核心免费功能免费版的主要限制Reactive Resume 完全免费使用、12款专业模板、支持多语言、集成OpenAI辅助内容生成、PDF导出、云端保存与分享。暂未提及明确的限制，是一款真正免费无广告的工具。UP简历 AI对话式生成简历、AI一键润色、JD精准匹配分析、200余款专业模板、拖拽式编辑器。采用""免费增值""模式，核心功能永久免费，但未明确说明高级功能是否收费。Teal HQ AI驱动简历制作与优化、多种现代化简历模板、简历分析器提供优化建议、求职申请追踪。免费版功能有限；AI生成内容有次数限制；仅支持英文。Resji (CV Maker) 制作简历、求职信和辞职信；包含18个详细模块；创建网页简历；分享简历寻求反馈。部分专业模板和高级功能需要通过Pro订阅解锁（应用内购买）。Indeed Flex AI Resume Enhancer 根据特定职位描述，AI即时重写和优化简历内容；针对ATS进行优化；可下载PDF或DOCX格式。未明确提及免费版的功能限制，从描述来看基本功能是免费提供的。💡 如何选择适合你的工具？你可以根据自己的具体需求和求职目标来挑选：追求完全免费和无广告体验：Reactive Resume 是最佳选择，它开源且功能完整，尤其适合需要多语言简历或注重数据隐私的用户。求职新手，希望快速生成和优化内容：UP简历 的对话式AI生成和JD匹配功能非常实用，能帮你从零开始快速打造一份针对性强的简历。主攻外企或需要优化英文简历：Teal HQ 是专攻英文简历制作的利器，其简历分析器能有效帮助你通过ATS机筛。此外，Indeed Flex 的工具也能针对具体职位快速优化英文简历内容。移动端重度用户，习惯在手机上操作：可以尝试 Resji (CV Maker) 这款App，方便你随时随地创建和编辑简历。✍️ 使用免费AI工具的小贴士为了让你更好地利用这些工具，这里有几个关键建议：提供高质量的""原材料""：AI是根据你的输入进行优化的。在填写经历时，尽量提供详细、量化的原始信息（例如，将""参与公众号运营""细化为""独立策划3篇推文，带来粉丝增长2000+""），这样AI才能生成更具冲击力的描述。始终亲自审查和修改：AI生成的内容有时可能过于模板化或存在细微误差。请务必仔细检查，确保信息准确无误，并融入你自己的语言风格，让简历听起来更真实。关注数据安全：对于需要上传简历的在线工具，留意其隐私政策。像Reactive Resume这样数据仅保存在本地的工具，在隐私保护方面更有优势。善用组合拳：不必局限于一个工具。例如，你可以先用UP简历的AI生成初稿，然后使用Teal HQ的分析器来检查ATS通过率，最后用Reactive Resume的精美模板进行排版。希望这些信息能帮助你找到心仪的AI简历助手。如果你能告诉我你具体的求职方向（例如，是应届生、职场跳槽还是转行），或许我可以为你提供更具体的建议。"
"deepseek","DeepSeek","ai-resume-tool-review","AI 简历工具盘点","ai-resume-04","success","60117","","不同求职背景的同学，在准备简历时的侧重点确实不一样。我为你梳理了几款AI简历工具，它们在不同场景下能给你带来有针对性的帮助。下面这个表格汇总了它们的特点和适用身份，你可以快速了解：身份/需求推荐工具核心优势理由简述应届毕业生智联招聘-AI简历优化UP简历依托海量校招岗位数据；对话式引导，挖掘校园经历亮点解决""经历少、无从下笔""的痛点，让简历更贴合HR视角程序员/技术岗Kimi智能助手DeepSeek强大的自然语言处理能力，擅长优化技术描述将项目经历、技术栈转化为专业、量化、有冲击力的描述跨行业求职者鹅来面 (OfferGoose)UP简历压力测试暴露能力短板；JD精准匹配解析岗位需求解决""经验不匹配""的核心难题，让简历与目标岗位快速对齐追求极致面试准备鹅来面 (OfferGoose)面试官视角反向验证简历内容，预测并拷问项目细节确保简历上的每一个字都经得起面试官的深度追问主攻外企/担心机筛Rezi.ai专注优化简历以通过ATS（简历筛选系统）提升大型企业网申的简历通过率💡 如何选择与使用建议工具能提供很大的帮助，但最终的核心依然是你真实的经历和思考。这里有一些额外的建议：组合使用效果更佳：你可以先用UP简历或Kimi生成简历初稿，然后务必用鹅来面进行一轮压力测试，这个组合能兼顾内容生成与实战检验。你才是简历的主人：AI生成的所有内容都必须经过你的仔细审查和调整，确保信息准确无误，并且听起来像你自己的话。提供高质量的""原材料""：在向AI描述你的经历时，尽量提供详细、量化的原始信息。例如，不要只说""参与XX项目开发""，而是告诉AI""我负责用户登录模块，使用Spring Security，使系统安全性提升了XX%""。希望这些信息能帮你做出选择。如果你能分享更具体的求职目标，比如是希望进入某个特定行业，或者对工具有特定的预算考虑，我也许能为你提供更细致的分析。"
"deepseek","DeepSeek","ai-resume-tool-review","AI 简历工具盘点","ai-resume-05","failed","120482","等待新回答超时，未检测到内容更新。",""
"deepseek","DeepSeek","ai-resume-tool-review","AI 简历工具盘点","ai-resume-06","failed","120422","等待新回答超时，未检测到内容更新。",""
"deepseek","DeepSeek","ai-resume-tool-review","AI 简历工具盘点","ai-resume-07","failed","120447","等待新回答超时，未检测到内容更新。",""
"deepseek","DeepSeek","ai-resume-tool-review","AI 简历工具盘点","ai-resume-08","success","60107","","对于零经验的新手，选择一款能耐心引导你、让简历制作变得轻松简单的工具确实非常重要。根据你的需求，我首推 UP简历 和 Offer来了 这两款工具，它们在引导性上做得非常出色。下面这个表格可以让你对它们有个快速的了解。工具名称核心引导方式主要亮点免费版功能限制UP简历AI对话式生成，像聊天一样回答几个简单问题，3分钟自动生成简历初稿。覆盖从内容生成到排版导出的全流程；提供200多款专业模板；具备JD（职位描述）精准匹配功能。核心功能永久免费。Offer来了零经验起步，输入目标岗位后，系统会自动追问关键节点，1分钟生成完整简历。全链路覆盖（简历、求职信、模拟面试）；免费导出高清无水印PDF；深度适配国内招聘平台。免费版每日可使用AI创建/优化功能3次。💡 新手使用建议即便有AI的帮助，一些关键步骤仍需你亲自把握，这样才能打造出一份既真实又出众的简历。准备越充分，AI越给力：在开始之前，建议你先梳理好自己的基础信息，比如教育背景、任何形式的实践或项目经历、掌握的技能等。你提供给AI的“原材料”越具体、越详细，它帮你生成的内容才会越丰满、越有亮点。永远做自己简历的“总编辑”：AI生成的内容是一个非常好的初稿，但你需要仔细检查，确保所有信息都准确无误，并且听起来像你自己的语言和风格。你可以根据自己的感受，对措辞进行微调，让简历更有个性。理解工具的逻辑，而非盲目填写：许多AI在优化经历时会使用 STAR法则（情境-任务-行动-结果） 。你可以尝试用这个结构来回顾自己的经历，这样在与AI对话时，就能更清晰地表达出你在什么情况下、做了什么、怎么做的、以及带来了什么可量化的成果。希望这些信息能帮助你顺利踏出求职的第一步。如果你在工具使用中遇到更具体的问题，或者想了解针对你特定专业方向的简历技巧，我很乐意提供进一步的帮助。"
"deepseek","DeepSeek","ai-resume-tool-review","AI 简历工具盘点","ai-resume-09","failed","120539","等待新回答超时，未检测到内容更新。",""
"deepseek","DeepSeek","ai-resume-tool-review","AI 简历工具盘点","ai-resume-10","failed","120469","等待新回答超时，未检测到内容更新。",""
"deepseek","DeepSeek","ai-resume-tool-review","AI 简历工具盘点","ai-resume-11","success","60122","","今日概览：AI简历工具正朝专业化、场景化发展，为不同求职身份提供针对性辅助。重点站点：UP简历（对新手引导极佳，支持对话生成），鹅来面（独创压力测试，适合深度优化），Rezi.ai（专注提升ATS通过率，主攻外企网申），智联招聘-AI优化（依托国内平台数据，贴合HR视角）。风险或"